{
  "meta": {
    "name": "One-Person AI Company",
    "version": "1.0",
    "created": "2026-08-24T00:00:00Z",
    "lastModified": "2026-08-24T00:00:00Z",
    "owner": "Owner-operator",
    "description": "Reference target architecture for a local service business run by one person with no employees. Five stages form a loop rather than a funnel: marketing rings the phone, intake catches it, sales books it, operations does the job, finance gets paid, and the collected cash sets next week's ad budget. Seven AI agent roles run it, and the approval gates sit on money and risk. Both are derived from the map by tools/ai_company.py rather than counted here, because a count in prose goes stale the first time a gate is added. Volumes are illustrative and sized for a one-van shop: 120 inbound leads a month, 96 real, 64 quoted, 38 won, average job around $1,450. Tool costs are deliberately absent - phase 1 of the readiness framework fills them from the business's real invoices, and a placeholder would be read as a fact. Replace every number here with the client's own before this becomes anyone's target design."
  },
  "departments": [
    {
      "id": "dept-marketing",
      "name": "Marketing & Demand",
      "owner": "Owner-operator",
      "description": "Spends the budget that last week's collected cash decided. This is the stage that closes the loop: it is downstream of finance, not upstream of everything.",
      "processes": [
        "proc-adspend"
      ],
      "tools": [
        "tool-ads",
        "tool-crm",
        "tool-rules"
      ]
    },
    {
      "id": "dept-intake",
      "name": "Intake & Qualification",
      "owner": "Owner-operator",
      "description": "Answers every channel with one brain and one calendar. The whole point is that nobody is promised a Thursday that is already gone.",
      "processes": [
        "proc-intake"
      ],
      "tools": [
        "tool-voice",
        "tool-sms",
        "tool-calendar",
        "tool-crm",
        "tool-rules"
      ]
    },
    {
      "id": "dept-sales",
      "name": "Sales & Quoting",
      "owner": "Owner-operator",
      "description": "Builds and sends the quote, chases it, and then stops. The close is a person: it is the gate the whole quoting stage exists to reach.",
      "processes": [
        "proc-quote"
      ],
      "tools": [
        "tool-crm",
        "tool-pricing",
        "tool-esign",
        "tool-sms"
      ]
    },
    {
      "id": "dept-ops",
      "name": "Operations & Delivery",
      "owner": "Owner-operator",
      "description": "The messy stage. A signature makes the job, the scope makes the material list, and a no-show sub is reassigned off the bench file before the owner has looked at their phone. The field work itself stays a person and always will.",
      "processes": [
        "proc-job"
      ],
      "tools": [
        "tool-jobs",
        "tool-calendar",
        "tool-bench",
        "tool-sms",
        "tool-esign"
      ]
    },
    {
      "id": "dept-finance",
      "name": "Finance & Collections",
      "owner": "Owner-operator",
      "description": "Not a department so much as what happens when a job ends. Closeout fires the invoice, Stripe collects, and an unpaid invoice writes its own reminder - which a person still approves before it sends.",
      "processes": [
        "proc-collect",
        "proc-reprice"
      ],
      "tools": [
        "tool-stripe",
        "tool-books",
        "tool-pricing",
        "tool-crm"
      ]
    },
    {
      "id": "dept-platform",
      "name": "Integration Layer",
      "owner": "Owner-operator",
      "description": "Not a stage - the substrate under all five. Claude Code reaches the CRM, the job system and the books over MCP; underneath that sit three plain files the owner edits directly: what things cost, what the rules are, and who is on the bench. No agent works from memory.",
      "processes": [],
      "tools": [
        "tool-mcp",
        "tool-pricing",
        "tool-rules",
        "tool-bench"
      ]
    }
  ],
  "processes": [
    {
      "id": "proc-intake",
      "name": "Catch and qualify an inbound lead",
      "category": "inbound",
      "owner": "Owner-operator",
      "frequency": "per inbound contact, about 120 a month",
      "description": "Everything that rings, texts or messages arrives here and leaves either booked, referred out, or nudged. One agent brain across every channel, reading the real calendar.",
      "kpi": {
        "metric": "Inbound contacts answered within 60 seconds",
        "target": "100%",
        "current": "unmeasured until the business is instrumented"
      },
      "steps": [
        {
          "number": 1,
          "title": "Receive inbound call, text or DM",
          "owner": "Intake agent",
          "executor": "ai",
          "tools": [
            "tool-voice",
            "tool-sms",
            "tool-crm"
          ],
          "frequency": 120,
          "notes": "Purpose: Catch every channel on the first ring so no lead waits for the owner to be free.\nInputs: Inbound call audio, SMS, web chat or social DM.\nProcedure: Telephony or the message inbox hands the intake agent a transcript and the channel it came from; the agent opens or matches a CRM lead.\nOutput: An open lead record with the raw first contact attached."
        },
        {
          "number": 2,
          "title": "Screen for spam or robocall",
          "owner": "Intake agent",
          "executor": "ai",
          "kind": "decision",
          "tools": [
            "tool-crm",
            "tool-rules"
          ],
          "frequency": 120,
          "branches": [
            {
              "label": "Real lead",
              "to": 3
            },
            {
              "label": "Spam",
              "to": "end"
            }
          ],
          "notes": "Purpose: Keep junk out of the pipeline and out of the lead count that marketing is judged on.\nInputs: The transcript and the caller's number.\nProcedure: The agent checks the number against known-junk lists and the transcript against the spam patterns in rules.md.\nOutput: Either a live lead, or a closed one tagged spam."
        },
        {
          "number": 3,
          "title": "Capture name, address and job description",
          "owner": "Intake agent",
          "executor": "ai",
          "tools": [
            "tool-crm"
          ],
          "frequency": 96,
          "notes": "Purpose: Get the four facts every later stage needs, while the client is still on the line.\nInputs: The live conversation.\nProcedure: The agent asks for name, service address, what is wrong, and how urgent it is, and writes each to the lead record as it goes.\nOutput: A lead record with contact, address, described scope and urgency."
        },
        {
          "number": 4,
          "title": "Check job type and address against rules.md",
          "owner": "Qualifier agent",
          "executor": "ai",
          "kind": "decision",
          "tools": [
            "tool-rules",
            "tool-crm"
          ],
          "frequency": 96,
          "branches": [
            {
              "label": "In service area",
              "to": 7
            },
            {
              "label": "Outside area",
              "to": 5
            }
          ],
          "notes": "Purpose: Refuse work outside the service area or the trades taken, before a slot is offered for it.\nInputs: Service address, described job type, rules.md.\nProcedure: The agent matches the address against the service area and the job type against the taken/refused lists.\nOutput: A decision to book or to refer out."
        },
        {
          "number": 5,
          "title": "Refer the lead to a partner shop",
          "owner": "Qualifier agent",
          "executor": "ai",
          "tools": [
            "tool-sms",
            "tool-rules"
          ],
          "frequency": 11,
          "notes": "Purpose: Turn work we cannot take into goodwill and a return referral, rather than a dead end.\nInputs: The lead record and the partner list in rules.md.\nProcedure: The agent sends the client the partner's details and notifies the partner with the scope.\nOutput: A referred lead and a logged referral."
        },
        {
          "number": 6,
          "title": "Close the lead as out of area",
          "owner": "Qualifier agent",
          "executor": "ai",
          "tools": [
            "tool-crm"
          ],
          "frequency": 11,
          "notes": "Purpose: End the branch explicitly so out-of-area volume is countable rather than invisible.\nInputs: The referred lead.\nProcedure: The agent closes the lead with reason 'out of area' and the partner it went to.\nOutput: A closed lead that still counts in the demand figures.",
          "kind": "end"
        },
        {
          "number": 7,
          "title": "Read the calendar for genuinely open slots",
          "owner": "Calendar sync",
          "executor": "automation",
          "tools": [
            "tool-calendar"
          ],
          "frequency": 85,
          "notes": "Purpose: Nobody gets promised a Thursday that is already gone. This is the whole reason intake reads the live calendar rather than a cached copy.\nInputs: The calendar, plus travel-time and job-duration rules.\nProcedure: The integration pulls free/busy for the next 14 days and subtracts travel time around existing jobs.\nOutput: Two or three offerable windows that will still be free when the client says yes."
        },
        {
          "number": 8,
          "title": "Offer the caller two real appointment windows",
          "owner": "Intake agent",
          "executor": "ai",
          "tools": [
            "tool-voice",
            "tool-sms",
            "tool-calendar"
          ],
          "frequency": 85,